{"artifact_schema_version":"2.0","authority_as_of":"2026-09-02T00:04:01-04:00","calendar_policy_identity":"US_EQUITIES_CORE_SESSION_V2","calendar_version":"2026-09-02.1","closures":[{"closure_date":"2026-01-01"},{"closure_date":"2026-01-19"},{"closure_date":"2026-02-16"},{"closure_date":"2026-04-03"},{"closure_date":"2026-05-25"},{"closure_date":"2026-06-19"},{"closure_date":"2026-07-03"}],"coverage_end":"2026-09-02","coverage_start":"2026-01-01","generated_at":"2026-09-02T00:04:01-04:00","operating_mic_agreement_status":"VERIFIED","operating_mic_scope":["XNYS","XNAS","XCBO"],"sessions":[{"close_type":"REGULAR","core_close_at":"2026-01-02T16:00:00-05:00","core_open_at":"2026-01-02T09:30:00-05:00","session_date":"2026-01-02"},{"close_type":"REGULAR","core_close_at":"2026-01-05T16:00:00-05:00","core_open_at":"2026-01-05T09:30:00-05:00","session_date":"2026-01-05"},{"close_type":"REGULAR","core_close_at":"2026-01-06T16:00:00-05:00","core_open_at":"2026-01-06T09:30:00-05:00","session_date":"2026-01-06"},{"close_type":"REGULAR","core_close_at":"2026-01-07T16:00:00-05:00","core_open_at":"2026-01-07T09:30:00-05:00","session_date":"2026-01-07"},{"close_type":"REGULAR","core_close_at":"2026-01-08T16:00:00-05:00","core_open_at":"2026-01-08T09:30:00-05:00","session_date":"2026-01-08"},{"close_type":"REGULAR","core_close_at":"2026-01-09T16:00:00-05:00","core_open_at":"2026-01-09T09:30:00-05:00","session_date":"2026-01-09"},{"close_type":"REGULAR","core_close_at":"2026-01-12T16:00:00-05:00","core_open_at":"2026-01-12T09:30:00-05:00","session_date":"2026-01-12"},{"close_type":"REGULAR","core_close_at":"2026-01-13T16:00:00-05:00","core_open_at":"2026-01-13T09:30:00-05:00","session_date":"2026-01-13"},{"close_type":"REGULAR","core_close_at":"2026-01-14T16:00:00-05:00","core_open_at":"2026-01-14T09:30:00-05:00","session_date":"2026-01-14"},{"close_type":"REGULAR","core_close_at":"2026-01-15T16:00:00-05:00","core_open_at":"2026-01-15T09:30:00-05:00","session_date":"2026-01-15"},{"close_type":"REGULAR","core_close_at":"2026-01-16T16:00:00-05:00","core_open_at":"2026-01-16T09:30:00-05:00","session_date":"2026-01-16"},{"close_type":"REGULAR","core_close_at":"2026-01-20T16:00:00-05:00","core_open_at":"2026-01-20T09:30:00-05:00","session_date":"2026-01-20"},{"close_type":"REGULAR","core_close_at":"2026-01-21T16:00:00-05:00","core_open_at":"2026-01-21T09:30:00-05:00","session_date":"2026-01-21"},{"close_type":"REGULAR","core_close_at":"2026-01-22T16:00:00-05:00","core_open_at":"2026-01-22T09:30:00-05:00","session_date":"2026-01-22"},{"close_type":"REGULAR","core_close_at":"2026-01-23T16:00:00-05:00","core_open_at":"2026-01-23T09:30:00-05:00","session_date":"2026-01-23"},{"close_type":"REGULAR","core_close_at":"2026-01-26T16:00:00-05:00","core_open_at":"2026-01-26T09:30:00-05:00","session_date":"2026-01-26"},{"close_type":"REGULAR","core_close_at":"2026-01-27T16:00:00-05:00","core_open_at":"2026-01-27T09:30:00-05:00","session_date":"2026-01-27"},{"close_type":"REGULAR","core_close_at":"2026-01-28T16:00:00-05:00","core_open_at":"2026-01-28T09:30:00-05:00","session_date":"2026-01-28"},{"close_type":"REGULAR","core_close_at":"2026-01-29T16:00:00-05:00","core_open_at":"2026-01-29T09:30:00-05:00","session_date":"2026-01-29"},{"close_type":"REGULAR","core_close_at":"2026-01-30T16:00:00-05:00","core_open_at":"2026-01-30T09:30:00-05:00","session_date":"2026-01-30"},{"close_type":"REGULAR","core_close_at":"2026-02-02T16:00:00-05:00","core_open_at":"2026-02-02T09:30:00-05:00","session_date":"2026-02-02"},{"close_type":"REGULAR","core_close_at":"2026-02-03T16:00:00-05:00","core_open_at":"2026-02-03T09:30:00-05:00","session_date":"2026-02-03"},{"close_type":"REGULAR","core_close_at":"2026-02-04T16:00:00-05:00","core_open_at":"2026-02-04T09:30:00-05:00","session_date":"2026-02-04"},{"close_type":"REGULAR","core_close_at":"2026-02-05T16:00:00-05:00","core_open_at":"2026-02-05T09:30:00-05:00","session_date":"2026-02-05"},{"close_type":"REGULAR","core_close_at":"2026-02-06T16:00:00-05:00","core_open_at":"2026-02-06T09:30:00-05:00","session_date":"2026-02-06"},{"close_type":"REGULAR","core_close_at":"2026-02-09T16:00:00-05:00","core_open_at":"2026-02-09T09:30:00-05:00","session_date":"2026-02-09"},{"close_type":"REGULAR","core_close_at":"2026-02-10T16:00:00-05:00","core_open_at":"2026-02-10T09:30:00-05:00","session_date":"2026-02-10"},{"close_type":"REGULAR","core_close_at":"2026-02-11T16:00:00-05:00","core_open_at":"2026-02-11T09:30:00-05:00","session_date":"2026-02-11"},{"close_type":"REGULAR","core_close_at":"2026-02-12T16:00:00-05:00","core_open_at":"2026-02-12T09:30:00-05:00","session_date":"2026-02-12"},{"close_type":"REGULAR","core_close_at":"2026-02-13T16:00:00-05:00","core_open_at":"2026-02-13T09:30:00-05:00","session_date":"2026-02-13"},{"close_type":"REGULAR","core_close_at":"2026-02-17T16:00:00-05:00","core_open_at":"2026-02-17T09:30:00-05:00","session_date":"2026-02-17"},{"close_type":"REGULAR","core_close_at":"2026-02-18T16:00:00-05:00","core_open_at":"2026-02-18T09:30:00-05:00","session_date":"2026-02-18"},{"close_type":"REGULAR","core_close_at":"2026-02-19T16:00:00-05:00","core_open_at":"2026-02-19T09:30:00-05:00","session_date":"2026-02-19"},{"close_type":"REGULAR","core_close_at":"2026-02-20T16:00:00-05:00","core_open_at":"2026-02-20T09:30:00-05:00","session_date":"2026-02-20"},{"close_type":"REGULAR","core_close_at":"2026-02-23T16:00:00-05:00","core_open_at":"2026-02-23T09:30:00-05:00","session_date":"2026-02-23"},{"close_type":"REGULAR","core_close_at":"2026-02-24T16:00:00-05:00","core_open_at":"2026-02-24T09:30:00-05:00","session_date":"2026-02-24"},{"close_type":"REGULAR","core_close_at":"2026-02-25T16:00:00-05:00","core_open_at":"2026-02-25T09:30:00-05:00","session_date":"2026-02-25"},{"close_type":"REGULAR","core_close_at":"2026-02-26T16:00:00-05:00","core_open_at":"2026-02-26T09:30:00-05:00","session_date":"2026-02-26"},{"close_type":"REGULAR","core_close_at":"2026-02-27T16:00:00-05:00","core_open_at":"2026-02-27T09:30:00-05:00","session_date":"2026-02-27"},{"close_type":"REGULAR","core_close_at":"2026-03-02T16:00:00-05:00","core_open_at":"2026-03-02T09:30:00-05:00","session_date":"2026-03-02"},{"close_type":"REGULAR","core_close_at":"2026-03-03T16:00:00-05:00","core_open_at":"2026-03-03T09:30:00-05:00","session_date":"2026-03-03"},{"close_type":"REGULAR","core_close_at":"2026-03-04T16:00:00-05:00","core_open_at":"2026-03-04T09:30:00-05:00","session_date":"2026-03-04"},{"close_type":"REGULAR","core_close_at":"2026-03-05T16:00:00-05:00","core_open_at":"2026-03-05T09:30:00-05:00","session_date":"2026-03-05"},{"close_type":"REGULAR","core_close_at":"2026-03-06T16:00:00-05:00","core_open_at":"2026-03-06T09:30:00-05:00","session_date":"2026-03-06"},{"close_type":"REGULAR","core_close_at":"2026-03-09T16:00:00-04:00","core_open_at":"2026-03-09T09:30:00-04:00","session_date":"2026-03-09"},{"close_type":"REGULAR","core_close_at":"2026-03-10T16:00:00-04:00","core_open_at":"2026-03-10T09:30:00-04:00","session_date":"2026-03-10"},{"close_type":"REGULAR","core_close_at":"2026-03-11T16:00:00-04:00","core_open_at":"2026-03-11T09:30:00-04:00","session_date":"2026-03-11"},{"close_type":"REGULAR","core_close_at":"2026-03-12T16:00:00-04:00","core_open_at":"2026-03-12T09:30:00-04:00","session_date":"2026-03-12"},{"close_type":"REGULAR","core_close_at":"2026-03-13T16:00:00-04:00","core_open_at":"2026-03-13T09:30:00-04:00","session_date":"2026-03-13"},{"close_type":"REGULAR","core_close_at":"2026-03-16T16:00:00-04:00","core_open_at":"2026-03-16T09:30:00-04:00","session_date":"2026-03-16"},{"close_type":"REGULAR","core_close_at":"2026-03-17T16:00:00-04:00","core_open_at":"2026-03-17T09:30:00-04:00","session_date":"2026-03-17"},{"close_type":"REGULAR","core_close_at":"2026-03-18T16:00:00-04:00","core_open_at":"2026-03-18T09:30:00-04:00","session_date":"2026-03-18"},{"close_type":"REGULAR","core_close_at":"2026-03-19T16:00:00-04:00","core_open_at":"2026-03-19T09:30:00-04:00","session_date":"2026-03-19"},{"close_type":"REGULAR","core_close_at":"2026-03-20T16:00:00-04:00","core_open_at":"2026-03-20T09:30:00-04:00","session_date":"2026-03-20"},{"close_type":"REGULAR","core_close_at":"2026-03-23T16:00:00-04:00","core_open_at":"2026-03-23T09:30:00-04:00","session_date":"2026-03-23"},{"close_type":"REGULAR","core_close_at":"2026-03-24T16:00:00-04:00","core_open_at":"2026-03-24T09:30:00-04:00","session_date":"2026-03-24"},{"close_type":"REGULAR","core_close_at":"2026-03-25T16:00:00-04:00","core_open_at":"2026-03-25T09:30:00-04:00","session_date":"2026-03-25"},{"close_type":"REGULAR","core_close_at":"2026-03-26T16:00:00-04:00","core_open_at":"2026-03-26T09:30:00-04:00","session_date":"2026-03-26"},{"close_type":"REGULAR","core_close_at":"2026-03-27T16:00:00-04:00","core_open_at":"2026-03-27T09:30:00-04:00","session_date":"2026-03-27"},{"close_type":"REGULAR","core_close_at":"2026-03-30T16:00:00-04:00","core_open_at":"2026-03-30T09:30:00-04:00","session_date":"2026-03-30"},{"close_type":"REGULAR","core_close_at":"2026-03-31T16:00:00-04:00","core_open_at":"2026-03-31T09:30:00-04:00","session_date":"2026-03-31"},{"close_type":"REGULAR","core_close_at":"2026-04-01T16:00:00-04:00","core_open_at":"2026-04-01T09:30:00-04:00","session_date":"2026-04-01"},{"close_type":"REGULAR","core_close_at":"2026-04-02T16:00:00-04:00","core_open_at":"2026-04-02T09:30:00-04:00","session_date":"2026-04-02"},{"close_type":"REGULAR","core_close_at":"2026-04-06T16:00:00-04:00","core_open_at":"2026-04-06T09:30:00-04:00","session_date":"2026-04-06"},{"close_type":"REGULAR","core_close_at":"2026-04-07T16:00:00-04:00","core_open_at":"2026-04-07T09:30:00-04:00","session_date":"2026-04-07"},{"close_type":"REGULAR","core_close_at":"2026-04-08T16:00:00-04:00","core_open_at":"2026-04-08T09:30:00-04:00","session_date":"2026-04-08"},{"close_type":"REGULAR","core_close_at":"2026-04-09T16:00:00-04:00","core_open_at":"2026-04-09T09:30:00-04:00","session_date":"2026-04-09"},{"close_type":"REGULAR","